{"data":{"load_factor":{"f64":"0x1.2e225d9d9f804p-2"},"max_sigma_vm":{"f64":"0x1.a7a71a2dbf8e5p+9"},"peak_location_xy":[{"f64":"0x0.0p+0"},{"f64":"0x0.0p+0"}],"peak_s":{"f64":"0x0.0p+0"},"peak_segment_id":{"type":"str","value":"e0"},"resultant_B":{"f64":"0x0.0p+0"},"resultant_Mx":{"f64":"0x1.fffffffffffa4p-1"},"resultant_My":{"f64":"0x0.0p+0"},"resultant_N":{"f64":"0x1.9000000000000p+6"},"segment_profiles":[{"key":{"type":"str","value":"e0"},"profile":{"length":{"f64":"0x1.0000000000000p+1"},"peak_sigma_vm":{"f64":"0x1.a7a71a2dbf8e5p+9"},"s_peak":{"f64":"0x0.0p+0"},"segment_id":{"type":"str","value":"e0"},"sigma_zz_coeffs":[{"f64":"-0x1.56db6db6db6dbp+3"},{"f64":"0x1.a606186186186p+9"}],"tau_membrane_coeffs":[{"f64":"-0x1.56db6db6db6dbp+3"},{"f64":"0x1.56db6db6db6dbp+4"},{"f64":"0x1.56db6db6db6dcp+5"}],"tau_sv_surface":{"f64":"0x0.0p+0"},"thickness":{"f64":"0x1.47ae147ae147bp-7"}}},{"key":{"type":"str","value":"e1"},"profile":{"length":{"f64":"0x1.0000000000000p+2"},"peak_sigma_vm":{"f64":"0x1.a7a71a2dbf8e5p+9"},"s_peak":{"f64":"0x0.0p+0"},"segment_id":{"type":"str","value":"e1"},"sigma_zz_coeffs":[{"f64":"0x0.0p+0"},{"f64":"0x1.a606186186186p+9"}],"tau_membrane_coeffs":[{"f64":"0x0.0p+0"},{"f64":"0x1.56db6db6db6dbp+4"},{"f64":"-0x1.56db6db6db6dcp+5"}],"tau_sv_surface":{"f64":"0x0.0p+0"},"thickness":{"f64":"0x1.47ae147ae147bp-7"}}},{"key":{"type":"str","value":"e2"},"profile":{"length":{"f64":"0x1.0000000000000p+2"},"peak_sigma_vm":{"f64":"0x1.9cfb107d7913ep+9"},"s_peak":{"f64":"0x0.0p+0"},"segment_id":{"type":"str","value":"e2"},"sigma_zz_coeffs":[{"f64":"0x0.0p+0"},{"f64":"0x1.9b4f3cf3cf3d0p+9"}],"tau_membrane_coeffs":[{"f64":"0x0.0p+0"},{"f64":"-0x1.56db6db6db6dbp+4"},{"f64":"0x1.56db6db6db6dcp+5"}],"tau_sv_surface":{"f64":"0x0.0p+0"},"thickness":{"f64":"0x1.47ae147ae147bp-7"}}},{"key":{"type":"str","value":"e3"},"profile":{"length":{"f64":"0x1.0000000000000p+1"},"peak_sigma_vm":{"f64":"0x1.a7a71a2dbf8e5p+9"},"s_peak":{"f64":"0x0.0p+0"},"segment_id":{"type":"str","value":"e3"},"sigma_zz_coeffs":[{"f64":"-0x1.56db6db6db6dbp+3"},{"f64":"0x1.a606186186186p+9"}],"tau_membrane_coeffs":[{"f64":"-0x1.56db6db6db6dbp+3"},{"f64":"0x1.56db6db6db6dbp+4"},{"f64":"0x1.56db6db6db6d9p+5"}],"tau_sv_surface":{"f64":"0x0.0p+0"},"thickness":{"f64":"0x1.47ae147ae147bp-7"}}}]},"format":"thinwallx","kind":"stress_result","number_encoding":"float64-hex","schema_version":"0.8","units":{"force":"unspecified","length":"mm"}}
