{"data":{"class":"Section","node_tolerance":{"f64":"0x1.12e0be826d695p-30"},"nodes":[{"id":{"type":"str","value":"n0"},"ref":"n0","x":{"f64":"0x0.0p+0"},"y":{"f64":"0x0.0p+0"}},{"id":{"type":"str","value":"n1"},"ref":"n1","x":{"f64":"0x0.0p+0"},"y":{"f64":"0x1.0000000000000p+0"}},{"id":{"type":"str","value":"n0"},"ref":"n2","x":{"f64":"0x0.0p+0"},"y":{"f64":"0x0.0p+0"}},{"id":{"type":"str","value":"n2"},"ref":"n3","x":{"f64":"0x1.0000000000000p+1"},"y":{"f64":"0x0.0p+0"}}],"safety_factor":null,"segments":[{"id":{"type":"str","value":"e0"},"p1":"n0","p2":"n1","t":{"f64":"0x1.47ae147ae147bp-7"}},{"id":{"type":"str","value":"e1"},"p1":"n2","p2":"n3","t":{"f64":"0x1.47ae147ae147bp-7"}}]},"format":"thinwallx","kind":"section","number_encoding":"float64-hex","schema_version":"0.8","units":{"force":"N","length":"mm"}}
