{"data":{"B":{"f64":"0x0.0p+0"},"M_omega":{"f64":"0x0.0p+0"},"Mx":{"f64":"0x1.999999999999ap-4"},"My":{"f64":"0x1.999999999999ap-5"},"N":{"f64":"0x1.0000000000000p+0"},"Tsv":{"f64":"0x0.0p+0"},"Vx":{"f64":"0x0.0p+0"},"Vy":{"f64":"0x0.0p+0"},"sigma_yield":{"f64":"0x1.f400000000000p+7"}},"format":"thinwallx","kind":"applied_loads","number_encoding":"float64-hex","schema_version":"0.8","units":{"force":"N","length":"mm"}}
