{"data":{"load_factor":{"f64":"0x1.9902068b4be17p+4"},"max_sigma_vm":{"f64":"0x1.38f3cf3cf3cf4p+3"},"peak_location_xy":[{"f64":"0x1.0000000000000p+2"},{"f64":"0x0.0p+0"}],"peak_s":{"f64":"0x1.0000000000000p+2"},"peak_segment_id":{"type":"str","value":"e1"},"resultant_B":{"f64":"0x0.0p+0"},"resultant_Mx":{"f64":"0x1.9999999999998p-4"},"resultant_My":{"f64":"0x1.999999999999ep-5"},"resultant_N":{"f64":"0x1.0000000000000p+0"},"segment_profiles":[{"key":{"type":"str","value":"e0"},"profile":{"length":{"f64":"0x1.0000000000000p+1"},"peak_sigma_vm":{"f64":"0x1.20f3cf3cf3cf4p+3"},"s_peak":{"f64":"0x0.0p+0"},"segment_id":{"type":"str","value":"e0"},"sigma_zz_coeffs":[{"f64":"-0x1.1249249249249p+0"},{"f64":"0x1.20f3cf3cf3cf4p+3"}],"tau_membrane_coeffs":[{"f64":"0x0.0p+0"},{"f64":"0x0.0p+0"},{"f64":"0x0.0p+0"}],"tau_sv_surface":{"f64":"0x0.0p+0"},"thickness":{"f64":"0x1.47ae147ae147bp-7"}}},{"key":{"type":"str","value":"e1"},"profile":{"length":{"f64":"0x1.0000000000000p+2"},"peak_sigma_vm":{"f64":"0x1.38f3cf3cf3cf4p+3"},"s_peak":{"f64":"0x1.0000000000000p+2"},"segment_id":{"type":"str","value":"e1"},"sigma_zz_coeffs":[{"f64":"0x1.8000000000000p-3"},{"f64":"0x1.20f3cf3cf3cf4p+3"}],"tau_membrane_coeffs":[{"f64":"0x0.0p+0"},{"f64":"0x0.0p+0"},{"f64":"0x0.0p+0"}],"tau_sv_surface":{"f64":"0x0.0p+0"},"thickness":{"f64":"0x1.47ae147ae147bp-7"}}},{"key":{"type":"str","value":"e2"},"profile":{"length":{"f64":"0x1.0000000000000p+2"},"peak_sigma_vm":{"f64":"0x1.e8c30c30c30c4p+2"},"s_peak":{"f64":"0x1.0000000000000p+2"},"segment_id":{"type":"str","value":"e2"},"sigma_zz_coeffs":[{"f64":"0x1.8000000000000p-3"},{"f64":"0x1.b8c30c30c30c4p+2"}],"tau_membrane_coeffs":[{"f64":"0x0.0p+0"},{"f64":"0x0.0p+0"},{"f64":"0x0.0p+0"}],"tau_sv_surface":{"f64":"0x0.0p+0"},"thickness":{"f64":"0x1.47ae147ae147bp-7"}}},{"key":{"type":"str","value":"e3"},"profile":{"length":{"f64":"0x1.0000000000000p+1"},"peak_sigma_vm":{"f64":"0x1.38f3cf3cf3cf4p+3"},"s_peak":{"f64":"0x0.0p+0"},"segment_id":{"type":"str","value":"e3"},"sigma_zz_coeffs":[{"f64":"-0x1.1249249249249p+0"},{"f64":"0x1.38f3cf3cf3cf4p+3"}],"tau_membrane_coeffs":[{"f64":"0x0.0p+0"},{"f64":"0x0.0p+0"},{"f64":"0x0.0p+0"}],"tau_sv_surface":{"f64":"0x0.0p+0"},"thickness":{"f64":"0x1.47ae147ae147bp-7"}}}]},"format":"thinwallx","kind":"stress_result","number_encoding":"float64-hex","schema_version":"0.8","units":{"force":"N","length":"mm"}}
