{"data":{"load_factor":{"f64":"0x1.384ff3b31f850p+4"},"max_sigma_vm":{"f64":"0x1.99d89d89d89d9p+3"},"peak_location_xy":[{"f64":"0x1.0000000000000p+2"},{"f64":"0x0.0p+0"}],"peak_s":{"f64":"0x1.0000000000000p+0"},"peak_segment_id":{"type":"str","value":"e6"},"resultant_B":{"f64":"0x0.0p+0"},"resultant_Mx":{"f64":"0x1.9999999999995p-4"},"resultant_My":{"f64":"0x1.99999999999a7p-5"},"resultant_N":{"f64":"0x1.0000000000000p+0"},"segment_profiles":[{"key":{"type":"str","value":"e0"},"profile":{"length":{"f64":"0x1.0000000000000p+0"},"peak_sigma_vm":{"f64":"0x1.79d89d89d89d8p+3"},"s_peak":{"f64":"0x0.0p+0"},"segment_id":{"type":"str","value":"e0"},"sigma_zz_coeffs":[{"f64":"-0x1.713b13b13b13bp+2"},{"f64":"0x1.79d89d89d89d8p+3"}],"tau_membrane_coeffs":[{"f64":"0x0.0p+0"},{"f64":"0x0.0p+0"},{"f64":"0x0.0p+0"}],"tau_sv_surface":{"f64":"0x0.0p+0"},"thickness":{"f64":"0x1.47ae147ae147bp-7"}}},{"key":{"type":"str","value":"e1"},"profile":{"length":{"f64":"0x1.0000000000000p+0"},"peak_sigma_vm":{"f64":"0x1.81d89d89d89d8p+3"},"s_peak":{"f64":"0x1.0000000000000p+0"},"segment_id":{"type":"str","value":"e1"},"sigma_zz_coeffs":[{"f64":"0x1.0000000000001p-2"},{"f64":"0x1.79d89d89d89d8p+3"}],"tau_membrane_coeffs":[{"f64":"0x0.0p+0"},{"f64":"0x0.0p+0"},{"f64":"0x0.0p+0"}],"tau_sv_surface":{"f64":"0x0.0p+0"},"thickness":{"f64":"0x1.47ae147ae147bp-7"}}},{"key":{"type":"str","value":"e2"},"profile":{"length":{"f64":"0x1.0000000000000p+0"},"peak_sigma_vm":{"f64":"0x1.9276276276275p+2"},"s_peak":{"f64":"0x1.0000000000000p+0"},"segment_id":{"type":"str","value":"e2"},"sigma_zz_coeffs":[{"f64":"0x1.0000000000001p-2"},{"f64":"0x1.8276276276275p+2"}],"tau_membrane_coeffs":[{"f64":"0x0.0p+0"},{"f64":"0x0.0p+0"},{"f64":"0x0.0p+0"}],"tau_sv_surface":{"f64":"0x0.0p+0"},"thickness":{"f64":"0x1.47ae147ae147bp-7"}}},{"key":{"type":"str","value":"e3"},"profile":{"length":{"f64":"0x1.0000000000000p+0"},"peak_sigma_vm":{"f64":"0x1.81d89d89d89d8p+3"},"s_peak":{"f64":"0x0.0p+0"},"segment_id":{"type":"str","value":"e3"},"sigma_zz_coeffs":[{"f64":"-0x1.713b13b13b13bp+2"},{"f64":"0x1.81d89d89d89d8p+3"}],"tau_membrane_coeffs":[{"f64":"0x0.0p+0"},{"f64":"0x0.0p+0"},{"f64":"0x0.0p+0"}],"tau_sv_surface":{"f64":"0x0.0p+0"},"thickness":{"f64":"0x1.47ae147ae147bp-7"}}},{"key":{"type":"str","value":"e4"},"profile":{"length":{"f64":"0x1.0000000000000p+1"},"peak_sigma_vm":{"f64":"0x1.91d89d89d89d8p+3"},"s_peak":{"f64":"0x1.0000000000000p+1"},"segment_id":{"type":"str","value":"e4"},"sigma_zz_coeffs":[{"f64":"0x1.0000000000001p-2"},{"f64":"0x1.81d89d89d89d8p+3"}],"tau_membrane_coeffs":[{"f64":"0x0.0p+0"},{"f64":"0x0.0p+0"},{"f64":"0x0.0p+0"}],"tau_sv_surface":{"f64":"0x0.0p+0"},"thickness":{"f64":"0x1.47ae147ae147bp-7"}}},{"key":{"type":"str","value":"e5"},"profile":{"length":{"f64":"0x1.0000000000000p+0"},"peak_sigma_vm":{"f64":"0x1.91d89d89d89d9p+3"},"s_peak":{"f64":"0x0.0p+0"},"segment_id":{"type":"str","value":"e5"},"sigma_zz_coeffs":[{"f64":"-0x1.713b13b13b13bp+2"},{"f64":"0x1.91d89d89d89d9p+3"}],"tau_membrane_coeffs":[{"f64":"0x0.0p+0"},{"f64":"0x0.0p+0"},{"f64":"0x0.0p+0"}],"tau_sv_surface":{"f64":"0x0.0p+0"},"thickness":{"f64":"0x1.47ae147ae147bp-7"}}},{"key":{"type":"str","value":"e6"},"profile":{"length":{"f64":"0x1.0000000000000p+0"},"peak_sigma_vm":{"f64":"0x1.99d89d89d89d9p+3"},"s_peak":{"f64":"0x1.0000000000000p+0"},"segment_id":{"type":"str","value":"e6"},"sigma_zz_coeffs":[{"f64":"0x1.0000000000001p-2"},{"f64":"0x1.91d89d89d89d9p+3"}],"tau_membrane_coeffs":[{"f64":"0x0.0p+0"},{"f64":"0x0.0p+0"},{"f64":"0x0.0p+0"}],"tau_sv_surface":{"f64":"0x0.0p+0"},"thickness":{"f64":"0x1.47ae147ae147bp-7"}}},{"key":{"type":"str","value":"e7"},"profile":{"length":{"f64":"0x1.0000000000000p+0"},"peak_sigma_vm":{"f64":"0x1.c276276276276p+2"},"s_peak":{"f64":"0x1.0000000000000p+0"},"segment_id":{"type":"str","value":"e7"},"sigma_zz_coeffs":[{"f64":"0x1.0000000000001p-2"},{"f64":"0x1.b276276276276p+2"}],"tau_membrane_coeffs":[{"f64":"0x0.0p+0"},{"f64":"0x0.0p+0"},{"f64":"0x0.0p+0"}],"tau_sv_surface":{"f64":"0x0.0p+0"},"thickness":{"f64":"0x1.47ae147ae147bp-7"}}},{"key":{"type":"str","value":"e8"},"profile":{"length":{"f64":"0x1.0000000000000p+0"},"peak_sigma_vm":{"f64":"0x1.99d89d89d89d9p+3"},"s_peak":{"f64":"0x0.0p+0"},"segment_id":{"type":"str","value":"e8"},"sigma_zz_coeffs":[{"f64":"-0x1.713b13b13b13bp+2"},{"f64":"0x1.99d89d89d89d9p+3"}],"tau_membrane_coeffs":[{"f64":"0x0.0p+0"},{"f64":"0x0.0p+0"},{"f64":"0x0.0p+0"}],"tau_sv_surface":{"f64":"0x0.0p+0"},"thickness":{"f64":"0x1.47ae147ae147bp-7"}}}]},"format":"thinwallx","kind":"stress_result","number_encoding":"float64-hex","schema_version":"0.8","units":{"force":"N","length":"mm"}}
