{"data":{"load_factor":{"f64":"0x1.4b08d3dcb08d3p+2"},"max_sigma_vm":{"f64":"0x1.82aaaaaaaaaacp+5"},"peak_location_xy":[{"f64":"0x0.0p+0"},{"f64":"0x0.0p+0"}],"peak_s":{"f64":"0x0.0p+0"},"peak_segment_id":{"type":"str","value":"e0"},"resultant_B":{"f64":"0x0.0p+0"},"resultant_Mx":{"f64":"0x1.999999999999dp-4"},"resultant_My":{"f64":"0x1.9999999999974p-5"},"resultant_N":{"f64":"0x1.0000000000001p+0"},"segment_profiles":[{"key":{"type":"str","value":"e0"},"profile":{"length":{"f64":"0x1.0000000000000p+0"},"peak_sigma_vm":{"f64":"0x1.82aaaaaaaaaacp+5"},"s_peak":{"f64":"0x0.0p+0"},"segment_id":{"type":"str","value":"e0"},"sigma_zz_coeffs":[{"f64":"-0x1.a400000000001p+5"},{"f64":"0x1.82aaaaaaaaaacp+5"}],"tau_membrane_coeffs":[{"f64":"0x0.0p+0"},{"f64":"0x0.0p+0"},{"f64":"0x0.0p+0"}],"tau_sv_surface":{"f64":"0x0.0p+0"},"thickness":{"f64":"0x1.47ae147ae147bp-7"}}},{"key":{"type":"str","value":"e1"},"profile":{"length":{"f64":"0x1.0000000000000p+1"},"peak_sigma_vm":{"f64":"0x1.82aaaaaaaaaacp+5"},"s_peak":{"f64":"0x0.0p+0"},"segment_id":{"type":"str","value":"e1"},"sigma_zz_coeffs":[{"f64":"-0x1.2c00000000002p+3"},{"f64":"0x1.82aaaaaaaaaacp+5"}],"tau_membrane_coeffs":[{"f64":"0x0.0p+0"},{"f64":"0x0.0p+0"},{"f64":"0x0.0p+0"}],"tau_sv_surface":{"f64":"0x0.0p+0"},"thickness":{"f64":"0x1.47ae147ae147bp-7"}}}]},"format":"thinwallx","kind":"stress_result","number_encoding":"float64-hex","schema_version":"0.8","units":{"force":"N","length":"mm"}}
